{
  "split_contract_version": "1.0",
  "split_policy_version": "lesson-exemplar-split-v1",
  "catalog_id": "synthetic-catalog",
  "catalog_fingerprint": "81fd27ce3f79b9ff158f4364d24bfe48965101fdfec8b586179342f1ffd2020d",
  "split_id": "split-81fd27ce3f79b9ff158f",
  "created_at": "2026-09-27T07:43:20Z",
  "authoring_group_count": 2,
  "holdout_group_count": 1,
  "authoring_availability": "AVAILABLE",
  "holdout_availability": "PARTIAL",
  "benchmark_availability": "PARTIAL",
  "authoring_group_ids": [
    "GR-00",
    "GR-02"
  ],
  "holdout_group_ids": [
    "GR-01"
  ],
  "authoring_exemplar_ids": [
    "EX-01",
    "EX-03"
  ],
  "holdout_exemplar_ids": [
    "EX-02"
  ],
  "split_fingerprint": "0c29d058bcec7864d52eb80e70b973fb7402afdc212e5ba68d3bdf951c9342e6"
}
